,id,url,title
0,t3_873iz8,https://www.thedailybeast.com/rick-santorum-to-student-activists-dont-march-learn-cpr?ref=home,"Rick Santorum to Student Activists: Don't March, Learn CPR"
1,t3_872dh1,https://www.theguardian.com/world/2018/mar/25/jehovahs-witnesses-accused-of-silencing-victims-of-child-abuse-uk,Jehovah's Witnesses accused of silencing victims of child abuse
2,t3_871f9l,https://www.cnn.com/2018/03/25/us/us-veteran-deported-to-mexico/index.html,US Army veteran who served two tours in Afghanistan has been deported to Mexico
3,t3_873m9g,http://www.foxnews.com/us/2018/03/25/man-sucker-punches-5-year-old-in-face-on-new-york-city-subway-cops.html,Man sucker punches 5-year-old in face on New York City subway
4,t3_871nxt,https://www.riverfronttimes.com/newsblog/2018/03/23/billy-busch-anheuser-busch-heir-charged-with-assaulting-6th-grader-at-basketball-practice,"Billy Busch, Anheuser-Busch Heir, Charged With Assaulting 6th Grader at Basketball Practice"
5,t3_86zwi8,https://news.sky.com/story/france-terror-attack-hero-policeman-married-hours-before-he-died-11303626,France terror attack: Hero policeman married hours before he died
6,t3_870ec6,https://www.reuters.com/article/us-religion-easter-pope-palmsunday/keep-shouting-dont-become-anesthetized-pope-tells-young-people-idUSKBN1H10E3,"Keep shouting, don't become anesthetized, pope tells young people"
7,t3_873vqo,https://www.theguardian.com/world/2018/mar/25/fire-in-siberian-shopping-mall-leaves-at-least-37-people-dead,Fire in Siberian shopping mall leaves at least 37 people dead
8,t3_875z4t,http://money.cnn.com/2018/03/25/news/companies/remington-bankruptcy/index.html,"Remington, one of America's oldest gun makers, files for bankruptcy"
9,t3_870x6i,http://www.omaha.com/outdoors/rare-whooping-crane-one-of-perhaps-only-in-the-world/article_eebfcaaa-4fd6-571d-9c60-8456d3ac3fda.html,Rare whooping crane — one of perhaps only 450 in the world — spotted near North Platte
10,t3_872h3d,https://www.usatoday.com/story/news/politics/2018/03/25/congress-gives-police-other-countries-easier-access-u-s-data-raising-privacy-concerns/452782002/,"Congress gives police in other countries easier access to U.S. data, raising privacy concerns"
11,t3_871ad6,http://pix11.com/2018/03/23/wrongfully-accused-man-released-after-spending-3-years-in-rikers/,Wrongfully accused man released after spending 3 years in Rikers
12,t3_871pqh,https://news.sky.com/story/chinese-space-station-to-crash-to-earth-on-easter-sunday-11304133,Chinese space station to crash to Earth on Easter Sunday
13,t3_871kp5,https://www.independent.co.uk/news/world/europe/drunk-pilot-flight-cancelled-100-passengers-stranded-stuttgart-tap-portugal-a8272506.html,"Drunk pilot removed from cockpit before takeoff leaving 100 passengers stranded Co-pilot on TAP Air Portugal flight seen walking unsteadily and smelling of alcohol, and has since had his flying licence suspended"
14,t3_873vap,http://english.alarabiya.net/en/News/gulf/2018/03/26/Saudi-Arabia-intercepts-missile-above-northeast-Riyadh.html,Saudi air defense intercept missile over Riyadh
15,t3_875ncg,http://mainepublic.org/post/more-states-move-end-tampon-tax-thats-seen-discriminating-against-women#stream/0,More States Move To End 'Tampon Tax' That's Seen As Discriminating Against Women
16,t3_875qm3,https://www.thedailybeast.com/the-mormon-church-must-learn-from-metoo,The Mormon Church is feeling the heat from sexual cover-ups
17,t3_8727br,https://www.telegraph.co.uk/news/2018/03/25/businessmen-working-russia-china-told-avoid-honeytraps/,Businessmen working in Russia and China told to avoid honeytraps
18,t3_87202o,http://www.cbc.ca/news/canada/aggregateiq-aiq-brexit-vote-leave-beleave-whistleblower-1.4592056,"Canadian firm AggregateIQ used to sidestep Brexit campaign spending limits, whistleblower alleges"
19,t3_871gco,https://www.news18.com/news/world/20-kids-taken-into-uk-state-care-over-parents-isis-links-report-1699331.html,20 Kids Taken Into UK State Care Over Parents' ISIS Links
20,t3_872h5b,https://www.elpasotimes.com/story/news/crime/2018/03/23/woman-gets-life-capital-murder-afghanistan-war-veteran-during-drug-robbery/454957002/?from=new-cookie,Woman gets life in capital murder of Afghanistan war veteran during drug robbery
21,t3_86zz4c,https://www.nbcbayarea.com/news/california/ACLU-Urges-Greyhound-to-Stop-Letting-Federal-Agents-on-Board-to-Conduct-Immigration-Sweeps-477722453.html,ACLU Urges Greyhound to Stop Letting Federal Agents on Board to Conduct Immigration Sweeps
22,t3_875jai,http://denver.cbslocal.com/2018/03/21/community-homeless-tiny-home/,Community Helps Homeless Man Build Tiny Home: ‘It Gets To Be Mine’
23,t3_871yho,https://www.thenewsstar.com/story/news/2018/03/21/angola-shakedown-guards-having-sex-prisoners/444684002/,"Angola guards having sex with inmates, smuggling drugs into prison"
24,t3_871znn,http://www.ksla.com/story/37797703/arkansas-jail-housing-200-roosters-as-cockfighting-evidence,Arkansas jail housing 200 roosters as cockfighting evidence
25,t3_875yza,https://www.independent.co.uk/news/world/africa/south-africa-white-farmers-eff-mbuyiseni-ndlozi-anc-interview-a8271096.html,"South Africa: Taking farms from whites is justified because 'it's not really their land', says EFF spokesman"
26,t3_86xqz2,https://www.reuters.com/article/us-usa-guns/no-more-or-we-vote-you-out-students-lead-huge-u-s-anti-gun-rallies-idUSKBN1H00BI?feedType=RSS&amp;feedName=domesticNews,'No more' or we vote you out: students lead huge U.S. anti-gun rallies
27,t3_875kaw,http://denver.cbslocal.com/2018/03/21/r-word-state-statutes/,‘R’ Word Banned From Hundreds of State Statutes On World Down Syndrome Day
28,t3_872ve3,https://news.sky.com/story/police-officer-with-serious-injures-after-sword-attack-11304166,Police officer left with 'serious injuries' after Manchester sword attack
29,t3_873evv,https://globalnews.ca/news/4104546/west-virginia-firefighters-killed/,2 West Virginia firefighters killed trying to reach fatal wreck - National
30,t3_86y9lq,http://losangeles.cbslocal.com/2018/03/23/la-ambitious-proposal-housing-every-homeless-person/,LA Considers Ambitious Proposal To Provide Housing For Every Homeless Person
31,t3_875dqy,https://www.reuters.com/article/us-global-markets/asian-shares-stumble-as-trade-war-fears-roil-global-markets-idUSKBN1H201V?utm_campaign=trueAnthem:+Trending+Content&amp;utm_content=5ab84ac204d30151ad1e0a3a&amp;utm_medium=trueAnthem&amp;utm_source=twitter,Asian shares stumble as trade war fears roil global markets
32,t3_86vkdj,http://money.cnn.com/2018/03/24/news/economy/restaurants-tips-spending-bill/index.html,"Few noticed, but Congress just banned restaurants from skimming tips"
33,t3_875fk1,https://www.thestar.com/news/world/2018/03/22/one-of-worlds-rarest-animals-born-in-jerusalem-zoo.html,One of world’s rarest animals born in Jerusalem zoo
34,t3_875onf,http://www.arabnews.com/node/1273566/saudi-arabia,Saudi air defense forces shoot down 7 Houthi missiles fired by Houthi militia
35,t3_86wfwx,https://www.lionsroar.com/dalai-lama-cancels-all-foreign-travel-due-to-age-and-exhaustion/,Dalai Lama cancels all foreign travel due to age and exhaustion
36,t3_8737bc,http://www.dw.com/en/thousands-of-africans-protest-israels-mass-deportation-plan/a-43120203,Thousands of Africans protest Israel's mass deportation plan
37,t3_86vl9i,https://www.independent.co.uk/news/world/americas/water-slide-boy-verr-ckt-child-death-decapitation-designers-no-qualifications-schlitterbahn-a8272036.html,Designers of water slide that decapitated boy 'had no technical qualifications'
38,t3_875j8z,http://www.starherald.com/news/local_news/former-kimball-hotel-managers-sentenced-to-prison-in-human-trafficking/article_1a5e2905-93eb-5172-be93-7b014989b67c.html,Former Kimball hotel managers sentenced to prison in human trafficking case involving nephew
39,t3_86z5lx,http://fox4kc.com/2018/03/23/court-documents-detail-allegations-of-negligence-in-design-of-schlitterbahn-water-slide-that-killed-10-year-old/,Director of Operations for the world's tallest waterslide faces 20 felony charges in connection to death of 10 year old boy who died while riding it
40,t3_873q3p,http://www.bbc.co.uk/news/world-europe-43531272,France gun attack: Trèbes held memorial Mass for victims
41,t3_872idt,https://www.local10.com/news/florida/miami-dade/2-arrested-in-connection-with-armed-robbery-of-uber-driver-in-northwest-miami-dade,2 arrested in connection with armed robbery of Uber driver in northwest Miami-Dade
42,t3_8714m6,http://www.bbc.com/news/world-europe-43533804,'Orange snow' baffles eastern European
43,t3_86whlk,http://wwmt.com/news/i-team/old-practices-fuel-health-concerns-as-health-officials-look-into-cancer-concerns,Small Michigan town with high rates of cancer and rare diseases looking at factory waste as the cause.
44,t3_8726jk,http://www.straitstimes.com/asia/south-asia/their-uighur-wives-have-vanished-in-china-dragnet-say-pakistani-businessmen,"Their Uighur wives have vanished in China dragnet, say Pakistani businessmen"
45,t3_873uxg,http://newyork.cbslocal.com/2018/02/28/brooklyn-phone-robbery/,"Police: Suspect Throws Teen Girl To The Ground, Runs Off With Her iPhone In Brooklyn"
46,t3_870avd,https://apnews.com/c97739bf3f974b7690a24856e949630e,Police: Officer shot knife-wielding man in NYC Whole Foods
47,t3_870o5i,http://www.foxnews.com/us/2018/03/25/texas-volunteers-find-severed-head-at-lake-police-say.html,Texas volunteers find severd head at lake.
48,t3_86zxxk,https://www.independent.co.uk/news/world/asia/elephant-smoking-video-india-nature-reserve-eating-charcoal-a8272126.html?amp,Elephant caught 'smoking' on camera leaves scientists baffled
49,t3_86sorm,https://www.chron.com/news/houston-texas/texas/article/Father-who-tried-to-sell-daughter-for-sex-to-12777791.php?ipid=happening,Father gets 60 years for trying to sell 4-year-old daughter for sex
50,t3_86sxtc,https://www.cnn.com/2018/03/24/europe/france-trebes-officer-dead/index.html,French officer who swapped places with a hostage in terror attack dies
51,t3_87628d,http://www.jpost.com/Middle-East/Syria-has-continued-developing-nuclear-program-Arab-site-says-547102,"Syria has continued developing nuclear program, Arab site says"
52,t3_8703do,http://www.bbc.com/news/world-europe-43532217,Carles Puigdemont: Former Catalan president 'detained' - BBC News
53,t3_8720dx,https://www.deseretnews.com/article/900013391/federal-appeals-court-upholds-utahs-controversial-election-law.html,Federal appeals court upholds Utah's controversial election law
54,t3_86vfe1,http://abcnews.go.com/US/wireStory/dallas-area-pastor-99-years-boys-starvation-death-53987304?cid=clicksource_4380645_1_hero_headlines_headlines_hed,Pastor gets 99 years in boy's starvation death
55,t3_86t8k8,https://www.theguardian.com/us-news/live/2018/mar/24/march-for-our-lives-protest-gun-violence-washington,March for Our Lives: hundreds of thousands demand end to gun violence – live
56,t3_8713pz,https://www.reuters.com/article/us-facebook-cambridge-analytica-apology/facebooks-zuckerberg-says-sorry-to-britons-with-newspaper-apology-ads-idUSKBN1H10AF,Facebook's Zuckerberg says sorry to Britons with newspaper apology ads
57,t3_8719g8,https://www.reuters.com/article/us-pope-china-taiwan/as-vatican-and-china-talk-taiwan-looks-on-nervously-idUSKBN1H107U,"As Vatican and China talk, Taiwan looks on nervously"
58,t3_86u170,https://www.hindustantimes.com/india-news/gujarat-man-gets-life-term-for-raping-impregnating-14-year-old-daughter/story-LMdVAJdQSBctn0OFglktVP.html,"35-year-old Man gets life term for raping, impregnating 14-year-old daughter"
59,t3_8718wl,https://www.catholicnewsagency.com/news/cardinal-tong-says-opposing-vatican-china-deal-is-unreasonable-67705,Cardinal Tong says opposing Vatican-China deal is 'unreasonable'
60,t3_86tdr8,http://www.kusi.com/black-lives-matter-protesters-block-sacramento-freeway-after-shooting-of-unarmed-black-man/,Black Lives Matter protesters block Sacramento freeway after shooting of unarmed black man
61,t3_86yd0k,https://www.ctvnews.ca/sci-tech/self-taught-rocket-scientist-launches-himself-570-metres-into-the-sky-1.3857534,Self-taught rocket scientist launches himself 570 metres into the sky
62,t3_8766iy,http://money.cnn.com/2018/03/25/technology/uber-grab-deal-southeast-asia/index.html,Uber is selling its Southeast Asia business to rival Grab
63,t3_86vzmg,https://www.eastbaytimes.com/2018/03/23/arroyo-high-school-placed-on-lockdown-friday-afternoon/,"Three students in custody, one found with firearm at Arroyo High School"
64,t3_86u2kq,https://www.sltrib.com/news/2018/03/23/as-youtube-bans-firearms-demonstrations-utah-firm-launching-its-own-pro-gun-video-platform/,"As YouTube bans firearms demonstrations, Utah firm launching its own pro-gun video platform"
65,t3_86zmg0,https://edition.cnn.com/2018/03/25/sport/cricket-australia-ball-tampering-intl/index.html?adkey=bn,Australia cricket captain resigns over ball tampering scandal
66,t3_86tays,http://time.com/5213857/daylight-saving-time-in-florida-bill/,FL Gov. Rick Scott signed off on legislation that would allow the state of Florida to remain on daylight saving time year-round.
67,t3_86w35h,http://www.bbc.co.uk/news/uk-england-oxfordshire-41608602,Oxford men guilty of sexual exploitation 'on a massive scale'
68,t3_86zqb0,http://www.rudaw.net/english/middleeast/iran/25032018,"Iran looks to China, Russia after ‘provocative’ US sanctions"
69,t3_86xjfn,http://wreg.com/2018/03/22/suspects-accused-of-raping-teen-posting-video-of-the-attack-on-facebook/,"Suspects accused of raping teen, posting video of the attack on Facebook"
70,t3_86vald,https://pitchfork.com/news/killer-mike-defends-gun-ownership-in-new-nra-video/,Killer Mike Defends Gun Ownership in New NRA Video
71,t3_86z245,https://www.cbsnews.com/news/mark-conditt-austin-bombing-suspect-psychopath-michael-mccaul/,"Austin bombing suspect called himself a ""psychopath,"" congressman says"
72,t3_86w73h,https://www.wsbtv.com/news/local/high-school-basketball-standout-sentenced-for-robbing-91-year-old-woman/720087451,High school basketball standout sentenced for robbing 91-year-old woman
73,t3_86te45,https://www.wsbtv.com/news/local/gwinnett-county/mother-crashed-car-into-pole-to-prove-to-kids-god-is-real-police-say/720719823,"Mother crashed car into pole to prove to kids God is real, police say"
74,t3_86y8et,http://www.orlandosentinel.com/news/fl-school-shooting-meadow-pollack-family-snub-20180324-story.html,Parkland shooting victim's brother says he was not allowed to speak at the March for Our Lives
75,t3_870ugg,https://tribuneweek.com/tumblr-blames-russia-used-its-platform-for-fake-news-during-us-elections/,Tumblr Blames Russia Used its platform for fake news during US Elections
76,t3_86xwe9,https://www.telegraph.co.uk/science/2018/03/25/lab-accidentally-created-city-180000-mice-experimented-without/,"Lab accidentally created 'city' of 180,000 mice and experimented on them without permission"
77,t3_86qex3,https://www.denverpost.com/2018/03/22/colorado-alternative-energy-storage/,Colorado among first states to give consumers the right to store energy from alternative sources. A new right — the ability to store energy without discrimination in rates or excessive barriers in connecting to the grid
78,t3_86x88e,https://www.mysanantonio.com/news/local/article/BCSO-Runaway-local-teen-was-abused-with-hot-oil-12777938.php,"BCSO: Runaway local teen was abused with hot oil, broomsticks for refusing arranged marriage"
79,t3_86q3ez,https://www.cbsnews.com/news/white-house-announces-ban-on-most-transgender-service-members/,White House announces ban on most transgender service members
80,t3_86yv6v,https://apnews.com/0d31d8346d8844939161be12614e61a5?utm_campaign=SocialFlow&amp;utm_source=Twitter&amp;utm_medium=AP&amp;__twitter_impression=true,British editor in UAE gets 10 years for wife's slaying
81,t3_86tjvp,http://www.foxnews.com/lifestyle/2018/03/22/utah-legalizes-free-range-parenting.html,Utah legalizes 'free-range parenting'
82,t3_86yyty,https://www.desmoinesregister.com/story/news/2018/03/24/creston-iowa-sharp-family-died-gas-asphyxiation-mexico-according-mexican-authorities/456500002/,Iowa family reported missing found dead in Mexico condominium
83,t3_86skx3,https://www.theguardian.com/books/2018/mar/20/waterstones-foyles-wh-smith-amazon-racist-books-on-websites,Booksellers remove racist and Holocaust denial titles from their websites
84,t3_86y6d6,https://www.telegraph.co.uk/news/2018/03/24/american-brasher-doubloon-gold-coin-struck-1787-sold-5-million/,American Brasher Doubloon gold coin struck in 1787 sold for more than $5 million
85,t3_86wej2,http://www.pennlive.com/news/2018/03/deportation_looms_for_man_who.html,"Deportation looms for man who admitted drugging, molesting 74-year-old West Shore woman"
86,t3_86wuj9,http://www.orlandosentinel.com/news/breaking-news/os-clemente-aguirre-recksiedler-hearing-20180312-story.html,Judge accused of bias won't step aside in re-trial of man sentenced to death in 2004 stabbings
87,t3_86stwx,https://www.nytimes.com/2018/03/24/business/wells-fargo-whistleblower-duke-tran.html,The Former Khmer Rouge Slave Who Blew the Whistle on Wells Fargo
88,t3_86vgov,http://www.foxnews.com/us/2018/03/24/wife-who-aided-illegal-immigrant-husband-in-slayings-2-sheriffs-deputies-gets-50-years.html,Wife who aided illegal immigrant husband in slayings of 2 sheriff's deputies gets 50 years
89,t3_86ws1n,https://www.thestar.com/news/gta/2018/03/23/tenants-say-flimsy-law-opens-door-to-renovictions.html,Tenants say ‘flimsy’ law opens door to ‘renovictions’
90,t3_86tjsg,http://www.grubstreet.com/2018/03/whole-foods-layoffs-reportedly-hit-marketing-team.html,Whole Foods Ends the Week With a Round of Layoffs
91,t3_86vcqz,http://indianexpress.com/article/cities/guwahati/in-assam-nagaon-11-year-old-gangraped-burnt-alive-two-juveniles-arrested-5109859/,"In Assam’s Nagaon, 11-year-old gangraped, burnt alive; two juveniles arrested"
92,t3_86se92,https://www.reuters.com/article/us-usa-trade-wto/u-s-steel-tariffs-meet-barrage-of-criticism-at-wto-idUSKBN1GZ1XI,U.S. steel tariffs meet barrage of criticism at WTO
93,t3_86ssa2,https://www.tennessean.com/story/news/local/davidson/2018/03/22/woman-says-nashville-nonprofit-leader-masturbated-front-her-federal-lawsuit/445756002/,Woman says Nashville nonprofit leader 'masturbated in front of her' in federal lawsuit
94,t3_86p2ki,https://www.theguardian.com/news/2018/mar/23/judge-grants-search-warrant-for-cambridge-analyticas-offices,Investigators raid offices of Cambridge Analytica after search warrant granted
95,t3_86nnt3,https://www.thewrap.com/mark-zuckerberg-has-lost-10-billion-in-the-last-week/,Mark Zuckerberg’s Net Worth Has Dropped $10 Billion in the Last Week
96,t3_86vu4g,http://www.republicworld.com/india-news/general-news/7-year-old-cancer-patient-becomes-mumbai-cop-for-a-day,7-year-old Cancer Patient becomes Mumbai Cop for a Day
97,t3_86xx9f,http://www.goerie.com/news/20180324/3-dead-in-apparent-double-homicide-suicide-in-erie,"3 dead in apparent double homicide, suicide in Erie"
98,t3_86w2ai,http://www.sandiegouniontribune.com/news/courts/sd-me-banda-case-20180323-story.html,"Case dismissed against unauthorized immigrant accused of felony DUI, hit and run"
99,t3_86z1j4,https://www.reuters.com/article/us-china-defence/china-air-force-drills-again-in-south-china-sea-western-pacific-idUSKBN1H103L,"China air force drills again in South China Sea, Western Pacific"
100,t3_86y18m,http://www.foxnews.com/us/2018/03/21/youth-soccer-league-probing-slurs-choking-girl-by-adult.html,Girl reportedly choked by parent in soccer match fight
101,t3_86y0ut,http://www.bbc.com/news/world-europe-43530154,Eurovision: First winner Lys Assia dies aged 94
102,t3_86ujal,http://abcnews.go.com/International/wireStory/pakistani-court-frees-20-killing-christian-couple-case-53984541,"Pakistani court frees 20 in killing of Christian couple case, were suspected of involvement in the lynching and burning alive of a Christian couple accused of blasphemy in 2014"
103,t3_86m1me,https://www.theverge.com/2018/3/23/17156402/elon-musk-deleted-tesla-and-spacex-facebook-pages-twitter-challenge,Elon Musk has deleted Tesla and SpaceX’s Facebook Pages after Twitter Challenge
104,t3_86ndkm,https://www.sfgate.com/business/article/Craigslist-ends-personal-ads-after-Congress-12776432.php?utm_campaign=reddit-desktop&amp;utm_source=CMS%20Sharing%20Button&amp;utm_medium=social,Craigslist ends personal ads after Congress passes anti-prostitution bill
105,t3_86v5cg,https://www.washingtonpost.com/news/education/wp/2018/03/22/students-push-back-on-clear-plastic-backpack-rule-at-marjory-stoneman-douglas-high/?utm_term=.5a48474c7af1,Students push back on clear plastic backpack rule at Marjory Stoneman Douglas High
106,t3_86q1fo,https://www.nbcnews.com/video/fatal-sacramento-shooting-police-chief-doesn-t-know-why-officers-turned-off-body-camera-audio-1192536131580,Fatal Sacramento shooting: Police chief doesn’t know why officers turned off body camera audio
107,t3_86ra2f,https://www.usatoday.com/story/news/nation-now/2018/03/23/passengers-take-over-greyhound-bus-stop-drowsy-driver/455199002/,Passengers take over Greyhound bus to stop drowsy driver
108,t3_86r2gr,https://news.avclub.com/chilling-legal-documents-reveal-just-how-shitty-the-pl-1824040852,"Chilling legal documents reveal just how shitty the ""planning"" behind lethal ""world's tallest"" waterslide really was"
109,t3_86ukbt,http://www.foxnews.com/us/2018/03/24/drivers-crash-fiery-death-at-travis-air-force-base-has-investigators-stumped.html,"Driver's crash, fiery death at Travis Air Force Base have investigators stumped"
110,t3_86tp3g,http://www.bbc.com/news/world-australia-43519439,Hamelin Bay: Nearly 150 beached whales die in Australia - BBC News
111,t3_86nz73,https://www.washingtonpost.com/investigations/attorney-says-roy-moore-supporters-offered-him-10000-to-drop-client-who-accused-the-senate-candidate-of-sexual-impropriety/2018/03/23/6d875f2c-02e3-11e8-93f5-53a3a47824e8_story.html,"Attorney says Roy Moore supporters offered him $10,000 to drop client who accused the Senate candidate of sexual impropriety"
112,t3_86rlu7,https://news.cgtn.com/news/31517a4d306b7a6333566d54/share.html,White House looks into reducing Chinese student visas
113,t3_86teha,http://nbc4i.com/2018/03/22/former-university-of-cincinnati-officer-ray-tensing-will-receive-344230-in-back-pay-legal-fees/,"Ex-officer charged with murder receives $344,000 settlement from the University of Cincinnati"
114,t3_86wgnq,https://www.reuters.com/article/us-libya-security-usa/u-s-says-killed-two-terrorists-in-southern-libya-air-strike-idUSKBN1H00PW?feedType=RSS&amp;feedName=worldNews&amp;utm_source=Twitter&amp;utm_medium=Social&amp;utm_campaign=Feed%3A+Reuters%2FworldNews+%28Reuters+World+News%29,U.S. says killed two 'terrorists' in southern Libya air strike
115,t3_86t4ro,http://www.bbc.com/news/newsbeat-43526392,Apple wants to introduce new emojis for disabled people
116,t3_86tfpt,https://www.nytimes.com/reuters/2018/03/23/technology/23reuters-usa-georgia-cyber.html,Atlanta Ransomware Attack Throws City Services Into Disarray
117,t3_86sig6,https://www.nbcdfw.com/news/local/Man-Arrested-in-Connection-with-Murder-of-81-Year-Old-Woman-477694563.html,"Man Charged in Murder of Woman, 81, 'Multiple' Victims Suspected and Hundreds of Cases Are Under Review"
118,t3_86t8p0,https://www.al.com/news/birmingham/index.ssf/2018/03/birmingham_police_officer_char_3.html,Birmingham police officer charged with 2 felony crimes
119,t3_86t53e,http://www.nysl.nysed.gov/libdev/opioid/index.html,Combatting the Opioid Epidemic: New York Libraries Save Lives
120,t3_86tqwg,https://www.news18.com/news/india/aadhaar-data-protected-by-13-feet-high-5-feet-thick-walls-attorney-general-to-sc-1696269.html,Indian Attorney General says data of citizens is protected by 13 feet high walls.
121,t3_86rg6j,http://mobile.abc.net.au/news/2018-03-24/robotic-t-rex-bursts-into-flames-at-us-theme-park/9583148,Robotic T Rex bursts into flames at US theme park - ABC News
122,t3_86j6gv,https://www.apnews.com/88f4568f781e44a7ba7e73e2e3206ad3/US-Postal-Service-to-unveil-Mister-Rogers-postage-stamp,US Postal Service to unveil Mister Rogers postage stamp
123,t3_86qvmr,http://www.sacbee.com/news/nation-world/national/article206200979.html,"Father who gave baby girl 28 rib fractures wanted a son instead, Ohio prosecutor says"
124,t3_86pebc,http://www.latimes.com/local/lanow/la-me-homeless-collapse-oc-20180322-story.html,O.C.'s grand homeless plan collapsing as residents balk at having shelters in their neighborhoods
125,t3_86ngc3,http://www.tulsaworld.com/homepagelatest/new-petition-seeks-to-put-recreational-marijuana-on-november-ballot/article_621e0396-1f75-5d0e-b60e-bfbfb74944c2.html,New petition seeks to put recreational marijuana on November ballot in Oklahoma
126,t3_86q4a1,http://time.com/5210976/instagram-chronological-feed-algorithm-changes/,Instagram Is Making a Big Change and Now New Posts Will Show Up First Again
127,t3_86ndo4,https://www.wired.com/story/california-net-neutrality-bill-would-go-beyond-original-protections/,California Net Neutrality Bill Would Go Beyond Original Protections
128,t3_86jrnj,http://www.bbc.co.uk/news/world-europe-43512791,Hostages taken at a supermarket after shots fired near Montpellier in southern France
129,t3_875vr4,http://www.foxnews.com/us/2018/03/25/march-for-our-lives-dc-crowd-smaller-than-organizers-estimates-imaging-company-says.html,"March for Our Lives DC crowd smaller than organizers' estimates 850k, imaging company says 202,796"
130,t3_86ks2q,http://www.omaha.com/columnists/hansen/hansen-omaha-man-liked-a-tweet-and-then-he-lost/article_74b9021a-3753-5b33-b096-f0af3c8372d6.html,"Omaha man ‘liked’ a tweet, and then he lost his dream job"
