,id,url,title
131,t3_86kxgw,https://www.cbsnews.com/news/rod-rosenstein-makes-cyber-law-announcement-live-updates/,"Rod Rosenstein announces indictment of Iranians for ""conspiring"" to hack U.S. entities"
132,t3_86qi03,https://www.sfexaminer.com/sfo-terminal-renamed-honor-harvey-milk/,SFO terminal to be renamed in honor of Harvey Milk
133,t3_86nivw,https://www.ajc.com/news/national/police-tell-man-congratulations-that-felony-after-arrest-impersonating-marshal-charge/q8G171vWhCIOOfpEpwptBI/,"Police tell man ‘Congratulations, that’s a felony’ after arrest on impersonating US Marshal charge"
134,t3_86sdcx,"http://english.ahram.org.eg/NewsContent/1/64/293381/Egypt/Politics-/BREAKING-Bombing-in-Egypts-Alexandria-one-killed,-.aspx",Bombing in Egypt Alexandria: one police officer killed and four others injured
135,t3_86jrmf,http://www.bbc.com/news/world-asia-43500299,"Russia 'arming the Afghan Taliban', says US"
136,t3_86sacc,https://www.aljazeera.com/news/2018/03/egypt-explosion-rocks-alexandria-stanley-neighbourhood-180324095410138.html,Egypt: Explosion in Alexandria's Stanley Neighbourhood
137,t3_86kpa2,http://www.news.com.au/finance/economy/world-economy/south-african-politician-says-australia-is-a-racist-country-farmers-should-leave-the-keys-when-they-go/news-story/e98607c4fa66d30d9b2731aa30e2a956,"South Africa farm attacks: Australia a ‘racist country’, Julius Malema says"
138,t3_86r03m,http://www.abc.net.au/news/2018-03-24/tropical-cyclone-nora-to-reach-category-four-queensland/9582386,Tropical Cyclone Nora expected to reach category four before hitting Queensland
139,t3_86plkx,https://www.chron.com/neighborhood/bellaire/news/article/Driver-hits-several-people-in-Montrose-parking-lot-12772851.php,"Driver charged with murder after allegedly ramming car into crowd in Montrose, killing young nurse"
140,t3_86mde0,http://www.kcci.com/article/mexican-news-source-4-americans-found-dead-in-tourist-complex/19576621,Iowan family that went missing in Mexico confirmed dead
141,t3_86lk8q,http://fox13now.com/2018/03/22/woman-who-accused-former-mtc-leader-of-sexual-assault-will-pursue-a-civil-lawsuit-against-the-lds-church/,Woman who accused former MTC leader of sexual assault will pursue a civil lawsuit against the LDS Church
142,t3_86pva4,http://www.espn.com/nfl/story/_/id/22885911/eagles-defensive-end-michael-bennett-indicted-injury-elderly-paraplegic-incident-super-bowl,Eagles' Michael Bennett indicted in Texas on felony charge of injury to the elderly
143,t3_86lzs8,https://www.seattletimes.com/nation-world/state-and-local-officials-say-near-end-of-rape-kit-backlog/,"A backlog of rape kits in Oregon is a year away from being eliminated following the passage of a state law mandating quicker testing, officials say."
144,t3_86kll7,http://www.sciencemag.org/news/2018/03/nasa-clean-room-contaminated-fungus,NASA ‘clean’ room is contaminated with fungus
145,t3_86gz24,http://www.kansascity.com/latest-news/article206165144.html,"Cop sucked suicidal man's toes and sexually assaulted him at hospital, Chicago police say"
146,t3_86fro6,https://www.thedailybeast.com/national-security-adviser-hr-mcmaster-to-resign-will-be-replaced-by-john-bolton,"National Security Adviser H.R. McMaster Resigns, Will Be Replaced by John Bolton"
147,t3_86n6h5,https://www.cincinnati.com/story/money/2018/03/23/report-kroger-target-flirt-mega-merger/452447002/,"Report: Kroger, Target flirt with mega-merger"
148,t3_86nj4b,https://www.thedailybeast.com/michigan-kindergartener-was-sodomized-and-photographed-nude-by-classmates-lawsuit,Michigan Kindergartener Was Sodomized and Photographed Nude by Classmates: Lawsuit
149,t3_86p1wa,https://apnews.com/6e76d9f5d6cd4b64bf7833e554c5323d/Indictment:-Waterslide-in-fatal-accident-was-'deadly-weapon',Indictment: Waterslide in fatal accident was 'deadly weapon'
150,t3_86qe8b,http://www.govexec.com/management/2018/03/long-proprietary-congressional-research-reports-will-now-be-made-public/146918/,Long-Proprietary Congressional Research Reports Will Now Be Made Public
151,t3_86rfwe,https://www.whitehouse.gov/briefings-statements/president-donald-j-trump-unveiling-america-first-national-space-strategy/,White House unveils ‘America First’ national space strategy
152,t3_86mxgw,https://www.cbsnews.com/news/france-hostage-situation-trebes-grocery-store-cop-swaps-himself-for-hostage-2018-03-23-live-updates/,"French police officer shot after swapping himself for hostage, officials say"
153,t3_86pvbd,http://www.bbc.com/news/technology-43523286,Uber crash - Sensor firm 'baffled' by self-driving death
154,t3_86j9s1,https://themoscowtimes.com/news/protests-rock-russian-town-after-over-50-children-poisoned-landfill-gas-60905,Protests Rock Russian Town After Over 50 Children Poisoned by Landfill Gas
155,t3_86joij,https://www.cbsnews.com/news/massive-blaze-on-nyc-movie-set-kills-firefighter/,"Massive blaze on set of Edward Norton, Bruce Willis movie kills firefighter"
156,t3_86mcd9,https://www.sfgate.com/chris-mcginnis/article/United-offers-traveler-10-000-to-get-off-plane-12774724.php,"United pays passenger $10,000 to get off plane"
157,t3_86ogzi,https://www.thedailybeast.com/two-americans-among-seven-westerners-killed-by-turkish-forces-in-syria,Two Americans Among Seven Westerners Killed by Turkish Forces in Syria
158,t3_86nqhz,http://www.foxnews.com/us/2018/03/23/man-celebrating-96g-settlement-with-hookers-robbed-cash.html,Man celebrating $96G settlement with hookers robbed of cash
159,t3_86qx7q,https://www.reuters.com/article/us-northkorea-missiles-southkorea/south-korea-says-north-agrees-to-hold-summit-preparation-talks-on-march-29-idUSKBN1H0045,South Korea says North agrees to hold summit preparation talks on March 29
160,t3_86nmuq,http://www.lji.org/news-events/news/post/western-diet-depletes-artery-protecting-immune-cells/,Western diet depletes artery-protecting immune cells
161,t3_86kf62,http://wnep.com/2018/03/22/superintendent-says-students-are-armed-with-rocks-in-case-of-a-school-shooting/,PA school district's answer to school shooters: arm each classroom with 5 gallon bucket of river rocks
162,t3_86k2w6,http://www.mlive.com/news/saginaw/index.ssf/2018/03/police_raiding_saginaw_diocese.html,"Police raiding Saginaw diocese, bishop's home in priest sex abuse probe"
163,t3_86lb85,https://www.theverge.com/2018/3/22/17131004/cloud-act-congress-omnibus-passed-mlat,House passes controversial legislation giving the US more access to overseas data
164,t3_86om60,http://www.sacbee.com/news/state/california/article206385859.html,Court: California colleges have duty to protect students
165,t3_86q4zs,https://navajotimes.com/reznews/county-ordered-to-hold-elections-using-new-districts/,San Juan County (Utah) ordered to hold elections using new districts
166,t3_86ojw3,http://www.cbc.ca/news/canada/british-columbia/anti-pipeline-protest-elizabeth-may-kennedy-stewart-1.4587631,Canadian Federal Green Party Leader Elizabeth May arrested at anti-pipeline protest
167,t3_86pgx1,https://www.theguardian.com/world/2018/mar/23/heroic-gendarme-swapped-places-with-hostage-in-french-attack,'Heroic' gendarme fights for life after latest police attack
168,t3_86njav,https://www.wftv.com/news/local/ex-police-sgt-sentenced-for-making-downloading-child-porn-in-patrol-car-computer/720476736,"Ex-police sgt. sentenced for making, downloading child porn in patrol car computer"
169,t3_86ku6t,http://www.woodtv.com/news/kent-county/lawsuit-kindergartners-sexually-assaulted-classmate/1066513048,Lawsuit: Kindergartners sexually assaulted classmate
170,t3_86enh7,https://www.theverge.com/2018/3/21/17147838/facebook-south-korea-slowing-user-internet-connections-reroute,South Korea fines Facebook $369K for slowing user internet connections
171,t3_86pkyf,http://www.abc.net.au/news/2018-03-22/chinese-students-angered-by-visa-processing-delays/9574838,Chinese students angered by visa delays as state media issues 'red alert' to not enrol in Australia
172,t3_86lefk,https://abcnews.go.com/Technology/wireStory/report-loss-plants-animals-making-lonelier-planet-53961351,"UN reports see a lonelier planet with fewer plants, animals"
173,t3_86muxn,https://news.usni.org/2018/03/23/u-s-warship-sails-past-disputed-south-china-sea-artificial-island-freedom-navigation-mission,U.S. Warship Sails Past Disputed South China Sea Artificial Island in Freedom of Navigation Mission
174,t3_86d4xd,https://www.usatoday.com/story/tech/talkingtech/2018/03/22/firefox-maker-mozilla-stop-facebook-advertising-because-data-scandal/448849002/,Firefox maker Mozilla to stop Facebook advertising because of data scandal
175,t3_86e4xj,http://money.cnn.com/2018/03/22/news/companies/toys-r-us-founder-obituary/index.html,Toys 'R' Us founder Charles Lazarus dies
176,t3_86gyiu,https://wtop.com/maryland/2018/03/16-year-old-girl-shot-md-high-school-taken-off-life-support-family-says/,"16-year-old girl shot at Md. high school taken off life support, family says"
177,t3_86my1z,https://sc.mp/2pBkvpv,China accuses US of ‘serious provocation’ in South China Sea
178,t3_86cg7n,https://www.washingtonpost.com/politics/trump-attorney-john-dowd-resigns-amid-shake-up-in-presidents-legal-team/2018/03/22/0472ce74-2de3-11e8-8688-e053ba58f1e4_story.html?utm_term=.9c8ba9e619a7,Trump personal attorney John Dowd resigns
179,t3_86mue3,https://972mag.com/israel-hands-out-demolition-notices-to-entire-bedouin-village/133997/,"Israel to demolish a Bedouin village, build a Jewish town in its place"
180,t3_86lk7m,https://www.cnn.com/2018/03/23/asia/australia-beached-whales-intl/index.html,More than 140 whales die on Australian beach
181,t3_86kgn5,http://abcnews.go.com/International/wireStory/venezuela-president-solution-inflation-change-money-53949279,Venezuela president solution to inflation: Change money
182,t3_86mruh,https://www.npr.org/sections/alltechconsidered/2018/03/21/591622450/section-230-a-key-legal-shield-for-facebook-google-is-about-to-change,"Section 230: A Key Legal Shield For Facebook, Google Is About To Change"
183,t3_86gxtf,https://www.usatoday.com/story/tech/news/2018/03/22/bye-facebook-hello-instagram-users-make-beeline-facebook-owned-social-network/433361002/,"Bye Facebook, hello Instagram: Users head for Facebook-owned social network"
184,t3_86j1ln,http://www.foxnews.com/us/2018/03/21/florida-men-one-dressed-in-bull-onesie-attempt-to-burn-down-house-with-ragu-sauce-police-say.html,"Florida men, one dressed in bull onesie, attempt to burn down house with Ragu sauce police say"
185,t3_86gjwn,https://www.inverse.com/article/42712-west-texas-sinkholes-oil-drilling-fluid-injection,"More Sinkholes Could Form as Texas is 'Punctured Like a Pin Cushion':""The ground movement we're seeing is not normal."""
186,t3_86bbca,https://www.thedailybeast.com/charges-dropped-against-turkish-officers-from-dc-brawl,No Charge for 11 Turkish Agents Accused of Attacking D.C. Protesters
187,t3_86nmuu,http://www.fox5atlanta.com/news/i-team/family-demands-10-million-for-death-of-son-in-gwinnett-jail,Family demands $10 million for death of son in Gwinnett jail - Story
188,t3_86lx5t,https://www.cnbc.com/2018/03/23/former-georgia-governor-and-us-senator-zell-miller-dies-at-86.html,Former Georgia governor and US senator Zell Miller dies at 86
189,t3_86lxoz,https://www.theglobeandmail.com/world/article-beijing-warns-of-peoples-war-against-us-with-chinese-consumers/,Beijing warns of ‘people’s war’ against U.S.: Chinese consumers now global superpower
190,t3_86krfn,https://www.justice.gov/live?utm_medium=email&amp;utm_source=govdelivery,Deputy Attorney General Rod Rosenstein and other law enforcement officials will hold a press conference for a major cyber law enforcement announcement. (10:00 ET)
191,t3_86p7fw,https://news.sky.com/story/easyjet-pilots-suspended-over-mid-flight-snapchat-clips-11300947,EasyJet pilots suspended over mid-flight Snapchat clips
192,t3_86pu0i,https://www.washingtonpost.com/world/the_americas/perus-new-president-vows-to-tackle-endemic-corruption/2018/03/23/e9e27782-2efd-11e8-8dc9-3b51e028b845_story.html?utm_term=.1338c1e0085e,Peru's new president vows to tackle endemic corruption
193,t3_86m7cs,http://www.wkyt.com/content/news/Senate-OKs-bill-to-ban-abortion-procedure-after-11-weeks-477690343.html,Senate OKs bill to ban abortion procedure after 11 weeks
194,t3_86kkxo,http://www.bbc.com/news/uk-politics-43489457,Russian spy: EU recalls Russia ambassador after nerve agent attack
195,t3_86mldh,https://wwjnews.radio.com/articles/michigan-man-accused-streaming-shooting-facebook-live,Michigan Man Accused Of Streaming Shooting On Facebook Live
196,t3_86gnzt,https://www.ice.gov/news/releases/ice-hsi-texarkana-arrests-120-people-during-illegal-cockfighting-event,ICE arrests 120 people during illegal cockfighting event in Arkansas
197,t3_86lh8e,https://www.cnbc.com/2018/03/23/us-indicts-iranian-nationals-in-iran-government-backed-scheme-on-us-universities.html,"Iranians cyber-attacked college professors, government agencies and companies: Justice Department"
198,t3_86bk7f,http://www.bbc.com/news/technology-43500714,YouTube gun ban drives bloggers to PornHub
199,t3_86gagk,http://www.kgw.com/article/news/local/oregon-initiative-would-ban-assault-weapons-require-owners-to-surrender-certain-guns/283-530640255,"Oregon initiative would ban assault weapons, require owners to surrender certain guns"
200,t3_86l02g,http://www.richmond.com/news/local/crime/bank-robber-s-surprise-confession-frees-innocent-man-but-it/article_04b54a9f-af2e-5d3f-b598-167c123b7036.html,"Bank robber’s surprise confession frees innocent man [after a decade], but it doesn't ease his conscience"
201,t3_86lr2e,http://abcnews.go.com/amp/GMA/Culture/anton-yelchins-parents-reach-settlement-fiat-chrysler/story?id=53962143,How Anton Yelchin's parents will honor his memory after settling lawsuit with Fiat Chrysler
202,t3_86f6e0,http://money.cnn.com/2018/03/22/investing/dow-jones-trade-war-china/index.html,Dow plunges 724 points as trade war fears rock Wall Street
203,t3_86xvbx,https://www.wpxi.com/news/top-stories/undocumented-immigrant-accused-in-burglary-spree-in-pittsburgh-area-1/720713630,Undocumented immigrant accused in burglary spree in Pittsburgh area
204,t3_86mxqs,https://www.reuters.com/article/us-britain-russia-eu/europeans-promise-more-steps-against-russia-over-uk-spy-attack-idUSKBN1GZ166?il=0,Europeans promise more steps against Russia over UK spy attack
205,t3_86maut,http://via.fox2now.com/IlC20,Missing Iowa family was set to land in St. Louis from Mexico
206,t3_86kkbz,https://www.cincinnati.com/story/news/2018/03/22/university-cincinnati-pays-cop-who-killed-sam-dubose/450587002/,Tensing settlement: University of Cincinnati pays ex-cop who killed Sam DuBose
207,t3_86d762,https://www.wthr.com/article/governor-signs-bill-making-cbd-oil-legal-in-indiana,Governor signs bill making CBD oil legal in Indiana
208,t3_86lzja,https://www.usatoday.com/story/travel/cruises/2018/03/23/royal-caribbean-takes-delivery-symphony-seas-worlds-largest-cruise-ship/449058002/?,"Royal Caribbean takes delivery of Symphony of the Seas, world's largest cruise ship"
209,t3_86ekjs,http://time.com/5211521/kansas-crusaders-bomb-plot-somali-muslims/,"Kansas Militia Members Known as 'The Crusaders' Wanted to Kill Muslims, Prosecutors Say"
210,t3_86lp92,http://wtvr.com/2018/03/22/these-d-c-moms-are-finding-housing-for-march-for-our-lives-students/,This mom’s tweet helped 500 students find free housing for March for Our Lives. (news article)
211,t3_86eh0z,https://wwjnews.radio.com/articles/police-warren-grandma-accidentally-shoots-toddler-ak-47,Grandma Accidentally Shoots Toddler With AK-47
212,t3_86hfoa,https://appleinsider.com/articles/18/03/22/police-using-fingerprints-dead-suspects-to-unlock-apple-iphones,Police using fingerprints of dead suspects to unlock Apple iPhones
213,t3_86mtf2,https://www.stripes.com/news/restrictions-on-va-dog-testing-included-in-massive-spending-bill-1.518281,Restrictions on VA dog testing included in massive spending bill
214,t3_86hpy5,https://www.theguardian.com/us-news/2018/mar/23/former-playboy-model-karen-mcdougal-says-trump-offered-cash-after-sex,Former Playboy model Karen McDougal says Trump offered cash after sex
215,t3_86kqr9,https://www.emirates247.com/offbeat/crazy-world/romanian-court-says-dead-man-can-get-driving-license-back-2018-03-23-1.667193,Romanian court says dead man can get his driving license back.
216,t3_86m9mz,https://www.cnn.com/2018/03/22/politics/donald-trump-china-tariffs-trade-war/index.html,"Trump hits China with tariffs, heightening concerns of global trade war"
217,t3_86jf8g,https://www.theverge.com/platform/amp/2018/3/22/17152120/digital-downloads-cd-vinyl-riaa-2017-report,Digital download sales fall below cd and vinyl
218,t3_86iccr,https://www.theguardian.com/world/2018/mar/22/bill-cosby-trial-latest-lawyers-ask-judge-step-aside-over-wife-assault-victims,"Bill Cosby lawyers ask judge to step aside over his wife's work with assault victims Cosby’s team contends that the judge’s rulings could appear to be influenced by his wife, an ‘activist and advocate for assault victims’"
219,t3_86j8wt,https://9to5mac.com/2018/03/22/police-fingerprints-iphone-face-id/,Report examines how police use fingerprints of dead people to unlock iPhones &amp; how Face ID is also vulnerable
220,t3_86caio,https://www.cnbc.com/2018/03/22/rents-are-rising-at-the-fastest-pace-in-almost-two-years.html,Rents are rising at the fastest pace in almost two years
221,t3_86knfi,http://www.bbc.com/news/world-asia-43497017,South Korea to shut off computers to stop people working late
222,t3_86l0zc,http://fox40.com/2018/03/22/fbi-arrests-former-stockton-mayor-anthony-silva/,Former Stockton Mayor Anthony Silva Arrested for Violating Terms of Protective Order
223,t3_86eupm,http://www.ksdk.com/article/news/nation-world/dow-tumbles-more-than-700-points-as-trade-war-fears-intensify/507-531039191,Dow tumbles more than 700 points as trade war fears intensify
224,t3_86l7j1,https://www.reuters.com/article/us-britain-russia-eu/europeans-to-take-new-steps-against-russia-over-uk-spy-idUSKBN1GZ166,Europeans to take new steps against Russia over UK spy
225,t3_86f17f,https://apnews.com/d10619351621427e89af77e62b43e1ee,The Latest: US to sell $1 billion in arms to Saudi Arabia
226,t3_86ivwn,https://www.cnn.com/2018/03/22/us/marjory-stoneman-douglas-clear-backpack-trnd/index.html,Marjory Stoneman Douglas will require students to carry only clear backpacks
227,t3_86axu3,http://www.bbc.com/news/world-asia-43497017,South Korea to shut off computers to stop people working late
228,t3_86hmj6,https://www.seattletimes.com/seattle-news/crime/this-is-now-a-crime-scene-trail-steward-recalls-finding-illegal-gingerbread-house-filled-with-child-porn/?utm_source=facebook&amp;utm_medium=social&amp;utm_campaign=article_left_1.1,‘This is now a crime scene’: Trail steward recalls finding illegal ‘gingerbread house’ filled with child porn
229,t3_86g38k,http://www.bbc.co.uk/news/technology-40643904,Nearly 70% of those aged 12-20 admit being abusive towards another person online.
230,t3_86jecy,http://www.latimes.com/world/asia/la-fg-australia-whales-20180323-story.html,Most of over 150 stranded whales die on Australian beach
231,t3_86dmnh,https://www.cbsnews.com/news/citigroup-imposes-restrictions-on-gun-sales-by-business-clients/,Citigroup restricts gun sales by customers
232,t3_86i3yv,https://www.billboard.com/articles/business/8257558/us-music-industry-2017-highest-revenue-in-decade-fueled-paid-subscriptions,"U.S. Music Industry Hits Highest Revenue Mark in a Decade, Fueled by Paid Subscriptions."
233,t3_86cr21,http://www.tulsaworld.com/news/usworld/world-s-largest-collection-of-ocean-garbage-is-now-twice/article_0f7b28ae-b883-568c-ad61-10af3b386d2e.html,World's largest collection of ocean garbage is now twice the size of Texas
234,t3_86d6wp,https://www.telegraph.co.uk/science/2018/03/22/bizarre-six-inch-alien-skeleton-found-buried-desert-human-baby/,"Bizarre six-inch 'alien' skeleton found buried in desert was human baby, scientists confirm"
235,t3_86f3r3,https://www.theverge.com/2018/3/22/17152120/digital-downloads-cd-vinyl-riaa-2017-report,CDs and vinyl are more popular than digital downloads once again
236,t3_868a5i,https://www.cnn.com/2018/03/21/us/nevada-teen-suspended-congressman-amodei-trnd/index.html,Nevada teen called his congressman and dropped an F-bomb while demanding action on guns. His school suspended him.
237,t3_86ia7k,https://www.theglobeandmail.com/canada/article-journalist-faces-unprecedented-criminal-charges-over-coverage-of/,Journalist faces unprecedented criminal charges over coverage of Muskrat Falls protest
238,t3_86i64t,https://www.denverpost.com/2018/03/21/ricardo-corral-venegas-sex-assault-aurora/,"Former police officer from Mexico sentenced to 72 years to life for sexually assaulting Aurora woman, other felonies"
239,t3_86gd9k,http://www.cbc.ca/news/canada/nova-scotia/on-the-night-he-nearly-died-this-man-resorted-to-leaving-the-er-to-call-911-for-help-1.4586010,"On the night he nearly died, this man resorted to leaving the ER to call 911 for help"
240,t3_867iv3,http://fox17.com/news/local/tennessee-man-wrongly-jailed-for-31-years-finally-becomes-a-millionaire,Tennessee man wrongly jailed for 31 years finally becomes a millionaire
241,t3_86hlew,https://www.cnet.com/news/huawei-dealt-blow-loses-best-buy-as-smartphone-laptop-smartwatch-retailer/,Best Buy to stop selling Huawei devices
